{
  "source_meta": {
    "supplier_name": "Arthrex",
    "system_name": "Arthrex Elbow Arthroscopy Portfolio",
    "source_type": "specialty_page",
    "source_document": "Elbow Arthroscopy",
    "source_version": "",
    "source_date": ""
  },
  "systems": [
    {
      "system_name": "Arthrex Elbow Arthroscopy Portfolio",
      "supplier_name": "Arthrex",
      "system_category": "Elbow sports medicine",
      "system_notes": "Portfolio-level public anchor for Arthrex elbow arthroscopy workflow resources."
    }
  ],
  "trays": [],
  "components": [
    {
      "component_name": "Elbow Arthroscopy Portfolio Family",
      "system_name": "Arthrex Elbow Arthroscopy Portfolio",
      "component_role": "Portfolio Family",
      "implant_category": "Arthroscopy Workflow",
      "component_notes": "Official Arthrex portfolio sources describe the broader elbow arthroscopy workflow family."
    }
  ],
  "products": [],
  "system_mappings": [],
  "unresolved_items": [
    {
      "entity_type": "tray",
      "raw_text": "This is a portfolio-level row rather than a single implant system, so no dedicated tray is asserted in this pass.",
      "reason": "Tray detail should only be added from narrower product-family sources.",
      "source_excerpt": "Current extraction is intentionally broad and source-backed."
    },
    {
      "entity_type": "product",
      "raw_text": "Portfolio-level sources do not expose a normalized product-code matrix.",
      "reason": "Product codes should be captured from narrower elbow arthroscopy device or implant-family sources.",
      "source_excerpt": "Current extraction remains portfolio-level only."
    }
  ]
}
