{
  "source_meta": {
    "supplier_name": "Arthrex",
    "system_name": "Arthrex Foot & ankle trauma fixation Portfolio",
    "source_type": "specialty_page",
    "source_document": "Foot and Ankle Trauma",
    "source_version": "",
    "source_date": ""
  },
  "systems": [
    {
      "system_name": "Arthrex Foot & ankle trauma fixation Portfolio",
      "supplier_name": "Arthrex",
      "system_category": "Foot & ankle trauma fixation",
      "system_notes": "Portfolio-level public anchor for Arthrex foot and ankle trauma fixation workflow resources."
    }
  ],
  "trays": [],
  "components": [
    {
      "component_name": "Foot and Ankle Trauma Fixation Portfolio Family",
      "system_name": "Arthrex Foot & ankle trauma fixation Portfolio",
      "component_role": "Portfolio Family",
      "implant_category": "Foot and Ankle Trauma Workflow",
      "component_notes": "Official Arthrex portfolio sources describe the broader foot and ankle trauma fixation workflow family."
    }
  ],
  "products": [],
  "system_mappings": [],
  "unresolved_items": [
    {
      "entity_type": "tray",
      "raw_text": "This is a portfolio-level row rather than a single implant system, so no dedicated tray is asserted in this pass.",
      "reason": "Tray detail should only be added from narrower trauma fixation product-family sources.",
      "source_excerpt": "Current extraction is intentionally broad and source-backed."
    },
    {
      "entity_type": "product",
      "raw_text": "Portfolio-level sources do not expose a normalized product-code matrix.",
      "reason": "Product codes should be captured from narrower foot and ankle trauma device or implant-family sources.",
      "source_excerpt": "Current extraction remains portfolio-level only."
    }
  ]
}
