{
  "source_meta": {
    "supplier_name": "Stryker",
    "system_name": "INFINITY Total Ankle",
    "source_type": "IFU",
    "source_document": "INFINITY Total Ankle Surgical Technique",
    "source_version": "Rev B",
    "source_date": "2024-01"
  },
  "systems": [
    {
      "system_name": "INFINITY Total Ankle",
      "supplier_name": "Stryker",
      "system_category": "Ankle Arthroplasty System",
      "system_notes": "Mobile-bearing total ankle replacement system."
    }
  ],
  "trays": [
    {
      "tray_name": "INFINITY Primary Instrument Tray",
      "system_name": "INFINITY Total Ankle",
      "tray_type": "Primary",
      "tray_notes": "Primary instrument tray referenced in the surgical technique."
    }
  ],
  "components": [
    {
      "component_name": "Tibial Tray",
      "system_name": "INFINITY Total Ankle",
      "component_role": "Tibial Component",
      "implant_category": "Ankle Implant",
      "component_notes": "Referenced as tibial tray in component overview."
    }
  ],
  "products": [
    {
      "sku": "INF-TT-001",
      "product_name": "INFINITY Tibial Tray Size 1",
      "component_name": "Tibial Tray",
      "packaging_type": "Sterile",
      "product_notes": "Size 1 implant packaging."
    }
  ],
  "system_mappings": [
    {
      "procedure_name": "Primary Total Ankle Replacement",
      "procedure_variant": "Fixed-Bearing Total Ankle Replacement",
      "system_name": "INFINITY Total Ankle",
      "data_source": "INFINITY Total Ankle Surgical Technique",
      "research_notes": "Procedure mapping supported by source document.",
      "last_verified": "2024-01"
    }
  ],
  "unresolved_items": [
    {
      "entity_type": "product",
      "raw_text": "Available in multiple insert sizes.",
      "reason": "Exact SKU list not provided in the supplied source text.",
      "source_excerpt": "Available in multiple insert sizes."
    }
  ]
}
