{
  "source_meta": {
    "supplier_name": "Arthrex",
    "system_name": "Arthrex Shoulder soft tissue Portfolio",
    "source_type": "specialty_page",
    "source_document": "Shoulder",
    "source_version": "",
    "source_date": ""
  },
  "systems": [
    {
      "system_name": "Arthrex Shoulder soft tissue Portfolio",
      "supplier_name": "Arthrex",
      "system_category": "Shoulder soft tissue",
      "system_notes": "Portfolio-level public anchor for Arthrex shoulder soft-tissue workflow resources."
    }
  ],
  "trays": [],
  "components": [
    {
      "component_name": "Shoulder Soft Tissue Portfolio Family",
      "system_name": "Arthrex Shoulder soft tissue Portfolio",
      "component_role": "Portfolio Family",
      "implant_category": "Shoulder Soft Tissue Workflow",
      "component_notes": "Official Arthrex portfolio sources describe the broader shoulder soft-tissue workflow family."
    }
  ],
  "products": [],
  "system_mappings": [],
  "unresolved_items": [
    {
      "entity_type": "tray",
      "raw_text": "This is a portfolio-level row rather than a single soft-tissue system, so no dedicated tray is asserted in this pass.",
      "reason": "Tray detail should only be added from narrower shoulder soft-tissue product-family sources.",
      "source_excerpt": "Current extraction is intentionally broad and source-backed."
    },
    {
      "entity_type": "product",
      "raw_text": "Portfolio-level sources do not expose a normalized product-code matrix.",
      "reason": "Product codes should be captured from narrower shoulder soft-tissue device or implant-family sources.",
      "source_excerpt": "Current extraction remains portfolio-level only."
    }
  ]
}
