{
  "source_meta": {
    "supplier_name": "Stryker",
    "system_name": "STAR Total Ankle",
    "source_type": "product_page",
    "source_document": "STAR Ankle",
    "source_version": "",
    "source_date": ""
  },
  "systems": [
    {
      "system_name": "STAR Total Ankle",
      "supplier_name": "Stryker",
      "system_category": "Total Ankle Replacement System",
      "system_notes": "Mobile-bearing total ankle arthroplasty platform for end-stage ankle arthritis with a three-component construct."
    }
  ],
  "trays": [
    {
      "tray_name": "STAR Ankle Instrumentation",
      "system_name": "STAR Total Ankle",
      "tray_type": "Instrumentation",
      "tray_notes": "Official STAR materials reference the surgical technique and dedicated ankle replacement instrumentation."
    }
  ],
  "components": [
    {
      "component_name": "STAR Tibial Component",
      "system_name": "STAR Total Ankle",
      "component_role": "Tibial Component",
      "implant_category": "Ankle Implant",
      "component_notes": "Official STAR materials describe the tibial implant as part of the mobile-bearing construct."
    },
    {
      "component_name": "STAR Talar Component",
      "system_name": "STAR Total Ankle",
      "component_role": "Talar Component",
      "implant_category": "Ankle Implant",
      "component_notes": "Official STAR materials describe the talar implant as part of the three-component ankle replacement."
    },
    {
      "component_name": "STAR Mobile Bearing Insert",
      "system_name": "STAR Total Ankle",
      "component_role": "Poly Insert",
      "implant_category": "Ankle Implant",
      "component_notes": "Official STAR materials describe the mobile-bearing polyethylene component within the system."
    }
  ],
  "products": [],
  "system_mappings": [],
  "unresolved_items": [
    {
      "entity_type": "product",
      "raw_text": "The official STAR pages define the three-component ankle replacement construct but this pass does not expose a public implant code table.",
      "reason": "A deeper IFU or ordering guide pass is required for product-code detail.",
      "source_excerpt": "Current extraction remains at tray and implant-family level."
    }
  ]
}
