{
  "source_meta": {
    "supplier_name": "Philips",
    "system_name": "Capnography Monitor",
    "source_type": "technology_page",
    "source_document": "Capnography Monitoring",
    "source_version": "",
    "source_date": ""
  },
  "systems": [
    {
      "system_name": "Capnography Monitor",
      "supplier_name": "Philips",
      "system_category": "Monitoring",
      "system_notes": "Public source anchor for the Philips capnography monitoring platform."
    }
  ],
  "trays": [],
  "components": [
    {
      "component_name": "Philips Capnography Monitoring Family",
      "system_name": "Capnography Monitor",
      "component_role": "Portfolio Family",
      "implant_category": "Monitoring Workflow",
      "component_notes": "Official Philips sources describe the broader capnography monitoring family."
    }
  ],
  "products": [],
  "system_mappings": [],
  "unresolved_items": [
    {
      "entity_type": "tray",
      "raw_text": "Public monitoring pages do not describe a dedicated tray in the current pass.",
      "reason": "Tray detail should only be added from narrower accessory or module sources.",
      "source_excerpt": "Current extraction is intentionally broad and source-backed."
    },
    {
      "entity_type": "product",
      "raw_text": "Public technology pages do not expose a normalized product-code matrix in this pass.",
      "reason": "Product codes should be captured from ordering guides or narrower monitor model sources.",
      "source_excerpt": "Current extraction remains high-level only."
    }
  ]
}
