{
  "source_meta": {
    "supplier_name": "Stryker",
    "system_name": "Katalyst Radial Head",
    "source_type": "product_page",
    "source_document": "Katalyst Radial Head System",
    "source_version": "",
    "source_date": ""
  },
  "systems": [
    {
      "system_name": "Katalyst Radial Head",
      "supplier_name": "Stryker",
      "system_category": "Radial Head Replacement",
      "system_notes": "Public source anchor for the Stryker Katalyst radial head arthroplasty system."
    }
  ],
  "trays": [],
  "components": [
    {
      "component_name": "Katalyst Radial Head Family",
      "system_name": "Katalyst Radial Head",
      "component_role": "Portfolio Family",
      "implant_category": "Radial Head Arthroplasty Workflow",
      "component_notes": "Official Stryker sources describe the broader Katalyst radial head arthroplasty family."
    }
  ],
  "products": [],
  "system_mappings": [],
  "unresolved_items": [
    {
      "entity_type": "tray",
      "raw_text": "Public radial head product pages do not describe a dedicated tray in the current pass.",
      "reason": "Tray detail should only be added from surgical technique or instrumentation sources.",
      "source_excerpt": "Current extraction is intentionally broad and source-backed."
    },
    {
      "entity_type": "product",
      "raw_text": "Public product pages do not expose a normalized product-code matrix in this pass.",
      "reason": "Product codes should be captured from ordering guides or narrower implant SKU sources.",
      "source_excerpt": "Current extraction remains high-level only."
    }
  ]
}
