{
  "source_meta": {
    "supplier_name": "DePuy Synthes",
    "system_name": "LCP Distal Femoral Plate",
    "source_type": "operative_technique_pdf",
    "source_document": "LCP Distal Femur Plate Surgical Technique",
    "source_version": "",
    "source_date": ""
  },
  "systems": [
    {
      "system_name": "LCP Distal Femoral Plate",
      "supplier_name": "DePuy Synthes",
      "system_category": "Locking Plate — Distal Femur",
      "system_notes": "Laterally placed distal femur locking plate system within the DePuy Synthes trauma portfolio."
    }
  ],
  "trays": [
    {
      "tray_name": "LCP Distal Femur Instrument Set",
      "system_name": "LCP Distal Femoral Plate",
      "tray_type": "Instrumentation",
      "tray_notes": "Official DePuy Synthes technique and catalog materials describe dedicated distal femur plating instrumentation."
    }
  ],
  "components": [
    {
      "component_name": "LCP Distal Femur Plate",
      "system_name": "LCP Distal Femoral Plate",
      "component_role": "Plate",
      "implant_category": "Trauma Implant",
      "component_notes": "Official DePuy Synthes materials describe the distal femur plate family."
    },
    {
      "component_name": "LCP Distal Femur Locking Screw",
      "system_name": "LCP Distal Femoral Plate",
      "component_role": "Screw",
      "implant_category": "Trauma Implant",
      "component_notes": "Official inventory materials describe compatible screw fixation for the distal femur plate system."
    },
    {
      "component_name": "LCP Distal Femur Drill Guide",
      "system_name": "LCP Distal Femoral Plate",
      "component_role": "Guide",
      "implant_category": "Instrumentation",
      "component_notes": "Official technique resources describe guide and instrumentation workflow for distal femur plate application."
    }
  ],
  "products": [],
  "system_mappings": [],
  "unresolved_items": [
    {
      "entity_type": "product",
      "raw_text": "Current official sources confirm the distal femur plate family and inventory references, but a full normalized product-code matrix has not yet been extracted in this pass.",
      "reason": "A deeper sterile implant listing or broader parts-matrix pass is required for comprehensive product-code detail.",
      "source_excerpt": "Current extraction remains at tray and implant-family level."
    }
  ]
}
