{
  "source_meta": {
    "supplier_name": "Stryker",
    "system_name": "Conserve Plus",
    "source_type": "product_page",
    "source_document": "Conserve Plus Total Resurfacing Implant",
    "source_version": "",
    "source_date": ""
  },
  "systems": [
    {
      "system_name": "Conserve Plus",
      "supplier_name": "Stryker",
      "system_category": "Hip Resurfacing",
      "system_notes": "Public source anchor for the Stryker Conserve Plus hip resurfacing system."
    }
  ],
  "trays": [],
  "components": [
    {
      "component_name": "Conserve Plus Resurfacing Family",
      "system_name": "Conserve Plus",
      "component_role": "Portfolio Family",
      "implant_category": "Hip Resurfacing Workflow",
      "component_notes": "Official Stryker sources describe the broader Conserve Plus hip resurfacing family."
    }
  ],
  "products": [],
  "system_mappings": [],
  "unresolved_items": [
    {
      "entity_type": "tray",
      "raw_text": "Public resurfacing product pages do not describe a dedicated tray in the current pass.",
      "reason": "Tray detail should only be added from surgical technique or instrumentation sources.",
      "source_excerpt": "Current extraction is intentionally broad and source-backed."
    },
    {
      "entity_type": "product",
      "raw_text": "Public product pages do not expose a normalized product-code matrix in this pass.",
      "reason": "Product codes should be captured from ordering guides or narrower implant SKU sources.",
      "source_excerpt": "Current extraction remains high-level only."
    }
  ]
}
